{
  "schema": "ardyn.phase-5.83.external-reference-policy-boundary-map-result",
  "schemaVersion": "0.1.0",
  "externalReferencePolicyKind": "external-reference-policy-boundary-map",
  "externalReferencePolicyMode": "review-only",
  "reviewedAt": "2026-07-09T00:00:00.000Z",
  "reviewedAtDefaulted": false,
  "classification": "valid_external_reference_policy_boundary_map_allowlist_enforced_federation_invariants_machine_checked",
  "externalReferencePolicyBoundaryMapProduced": true,
  "boundaryEntries": [
    {
      "boundaryId": "phase5-83.ardyn.glossopetrae",
      "boundaryFamily": "glossopetrae_reference",
      "relatedSystem": "ardyn",
      "currentStatus": "active",
      "referenceFamily": "glossopetrae",
      "source": "Phase 5.60 GLOSSOPETRAE encoded-handoff conformance (tests/phase5-60-inter-agent-encoded-handoff-conformance.test.mjs)",
      "referenceStatus": "architecture_reference_only",
      "unsafeFamilies": [
        "encoded_handoff_runtime",
        "codec_runtime",
        "translator_runtime",
        "stego_covert_channel"
      ],
      "allowedCurrentBehavior": [
        "Reference GLOSSOPETRAE as the gold-standard pattern for unsafe-field metadata + test-asserted rejections + CLI keyword probes."
      ],
      "forbiddenCurrentBehavior": [
        "Implement encoded-handoff runtime, codec, translator, or steganographic covert channel in Ardyn."
      ],
      "owningPhase": "5.60",
      "testCoveragePointer": "tests/phase5-60-inter-agent-encoded-handoff-conformance.test.mjs",
      "requiredFutureContractBeforeImplementation": [],
      "requiredFutureAuthorizationPhaseBeforeRuntime": "none (active)",
      "crossPhaseReferences": [],
      "explicitBlockedAuthorizationFlags": {
        "runtimeAuthorized": false,
        "authorizesRuntime": false,
        "commandExposureAuthorizationGranted": false,
        "approvalDecisionProduced": false,
        "approvalGrantProduced": false
      },
      "unsafeExternalReferencePolicyRuntimeFlags": {
        "runtimeExecutionEnabled": false,
        "runtimeAuthorizationEnabled": false,
        "runtimeCommandEnabled": false,
        "commandExposureEnabled": false,
        "commandsExposed": false,
        "connectorGrantProduced": false,
        "shellRuntimeEnabled": false,
        "sqliteRuntimeEnabled": false,
        "embeddedDbReaderEnabled": false,
        "databaseClientImplemented": false,
        "matrixClientRuntimeEnabled": false,
        "externalGatewayRuntimeEnabled": false,
        "fabricCoreTransportRuntimeEnabled": false,
        "fabricRuntimeImplementedByArdyn": false,
        "secureDropImplemented": false,
        "secureDropDecryptionEnabled": false,
        "filesystemAccessEnabled": false,
        "filesystemReadEnabled": false,
        "filesystemWriteEnabled": false,
        "backendRuntimeImplementedByArdyn": false,
        "processSpawnEnabled": false,
        "processControlEnabled": false,
        "blockedCliBypassEnabled": false,
        "dhtSwarmP2pEnabled": false,
        "bitTorrentEnabled": false,
        "trainingGpuDependencyAdded": false,
        "mlFrameworkDependencyAdded": false
      },
      "runtimeEffect": {
        "runtimeEnabled": false,
        "runtimeStarted": false,
        "runtimeReady": false,
        "runtimeCommandEnabled": false,
        "runtimeCommandExposureEnabled": false,
        "runtimeExecutionEnabled": false,
        "runtimeExecuted": false,
        "approvalGrantProduced": false,
        "approvalGrantPersisted": false,
        "approvalEvaluatorAuthoritative": false
      },
      "nonAuthorizingProof": true,
      "externalReferencePolicyBoundaryMetadataOnly": true,
      "noLiveExternalReferencePolicyRuntimePerformed": true
    },
    {
      "boundaryId": "phase5-83.ardyn.hermes_agent",
      "boundaryFamily": "hermes_agent_import_block",
      "relatedSystem": "ardyn",
      "currentStatus": "active",
      "referenceFamily": "hermes_agent",
      "source": "NousResearch/hermes-agent (external repository)",
      "referenceStatus": "external_canonical_owner",
      "unsafeFamilies": [
        "hermes_agent_import",
        "cua_driver_runtime",
        "computer_use_runtime",
        "agent_mode_runtime"
      ],
      "allowedCurrentBehavior": [
        "Reference hermes-agent as the harness that edits this repo; cite in docs."
      ],
      "forbiddenCurrentBehavior": [
        "Vendor or import hermes-agent code into Ardyn packages or apps.",
        "Add hermes* as an npm dependency."
      ],
      "owningPhase": "5.83",
      "testCoveragePointer": "tests/phase5-83-external-reference-policy.test.mjs (import guard + forbidden-pattern scan)",
      "requiredFutureContractBeforeImplementation": [],
      "requiredFutureAuthorizationPhaseBeforeRuntime": "none (active)",
      "crossPhaseReferences": [],
      "explicitBlockedAuthorizationFlags": {
        "runtimeAuthorized": false,
        "authorizesRuntime": false,
        "commandExposureAuthorizationGranted": false,
        "approvalDecisionProduced": false,
        "approvalGrantProduced": false
      },
      "unsafeExternalReferencePolicyRuntimeFlags": {
        "runtimeExecutionEnabled": false,
        "runtimeAuthorizationEnabled": false,
        "runtimeCommandEnabled": false,
        "commandExposureEnabled": false,
        "commandsExposed": false,
        "connectorGrantProduced": false,
        "shellRuntimeEnabled": false,
        "sqliteRuntimeEnabled": false,
        "embeddedDbReaderEnabled": false,
        "databaseClientImplemented": false,
        "matrixClientRuntimeEnabled": false,
        "externalGatewayRuntimeEnabled": false,
        "fabricCoreTransportRuntimeEnabled": false,
        "fabricRuntimeImplementedByArdyn": false,
        "secureDropImplemented": false,
        "secureDropDecryptionEnabled": false,
        "filesystemAccessEnabled": false,
        "filesystemReadEnabled": false,
        "filesystemWriteEnabled": false,
        "backendRuntimeImplementedByArdyn": false,
        "processSpawnEnabled": false,
        "processControlEnabled": false,
        "blockedCliBypassEnabled": false,
        "dhtSwarmP2pEnabled": false,
        "bitTorrentEnabled": false,
        "trainingGpuDependencyAdded": false,
        "mlFrameworkDependencyAdded": false
      },
      "runtimeEffect": {
        "runtimeEnabled": false,
        "runtimeStarted": false,
        "runtimeReady": false,
        "runtimeCommandEnabled": false,
        "runtimeCommandExposureEnabled": false,
        "runtimeExecutionEnabled": false,
        "runtimeExecuted": false,
        "approvalGrantProduced": false,
        "approvalGrantPersisted": false,
        "approvalEvaluatorAuthoritative": false
      },
      "nonAuthorizingProof": true,
      "externalReferencePolicyBoundaryMetadataOnly": true,
      "noLiveExternalReferencePolicyRuntimePerformed": true
    },
    {
      "boundaryId": "phase5-83.ardyn.cua_computer_use",
      "boundaryFamily": "cua_computer_use_reference",
      "relatedSystem": "ardyn",
      "currentStatus": "active",
      "referenceFamily": "cua_computer_use",
      "source": "Phase 5.68 agent-mode/profile/skillhub capability boundary map",
      "referenceStatus": "taxonomy_reference_only",
      "unsafeFamilies": [
        "cua_driver_runtime",
        "computer_use_runtime",
        "agent_mode_runtime",
        "profile_loader",
        "skill_loader"
      ],
      "allowedCurrentBehavior": [
        "Record taxonomy metadata for CUA/computer-use capabilities."
      ],
      "forbiddenCurrentBehavior": [
        "Implement CUA driver, computer-use runtime, or agent-mode runtime in Ardyn.",
        "Add cua* as a dependency."
      ],
      "owningPhase": "5.68",
      "testCoveragePointer": "tests/phase5-68-agent-mode-profile-skillhub-capability-boundary-map.test.mjs",
      "requiredFutureContractBeforeImplementation": [],
      "requiredFutureAuthorizationPhaseBeforeRuntime": "none (active)",
      "crossPhaseReferences": [],
      "explicitBlockedAuthorizationFlags": {
        "runtimeAuthorized": false,
        "authorizesRuntime": false,
        "commandExposureAuthorizationGranted": false,
        "approvalDecisionProduced": false,
        "approvalGrantProduced": false
      },
      "unsafeExternalReferencePolicyRuntimeFlags": {
        "runtimeExecutionEnabled": false,
        "runtimeAuthorizationEnabled": false,
        "runtimeCommandEnabled": false,
        "commandExposureEnabled": false,
        "commandsExposed": false,
        "connectorGrantProduced": false,
        "shellRuntimeEnabled": false,
        "sqliteRuntimeEnabled": false,
        "embeddedDbReaderEnabled": false,
        "databaseClientImplemented": false,
        "matrixClientRuntimeEnabled": false,
        "externalGatewayRuntimeEnabled": false,
        "fabricCoreTransportRuntimeEnabled": false,
        "fabricRuntimeImplementedByArdyn": false,
        "secureDropImplemented": false,
        "secureDropDecryptionEnabled": false,
        "filesystemAccessEnabled": false,
        "filesystemReadEnabled": false,
        "filesystemWriteEnabled": false,
        "backendRuntimeImplementedByArdyn": false,
        "processSpawnEnabled": false,
        "processControlEnabled": false,
        "blockedCliBypassEnabled": false,
        "dhtSwarmP2pEnabled": false,
        "bitTorrentEnabled": false,
        "trainingGpuDependencyAdded": false,
        "mlFrameworkDependencyAdded": false
      },
      "runtimeEffect": {
        "runtimeEnabled": false,
        "runtimeStarted": false,
        "runtimeReady": false,
        "runtimeCommandEnabled": false,
        "runtimeCommandExposureEnabled": false,
        "runtimeExecutionEnabled": false,
        "runtimeExecuted": false,
        "approvalGrantProduced": false,
        "approvalGrantPersisted": false,
        "approvalEvaluatorAuthoritative": false
      },
      "nonAuthorizingProof": true,